{
 "version": 1,
 "source": "https://models.dev/api.json",
 "fetchedAt": "2026-10-28",
 "entries": [
  {
   "id": "302ai",
   "name": "302.AI",
   "baseUrl": "https://api.302.ai/v1",
   "docsUrl": "https://doc.302.ai",
   "visionModels": [
    "gemini-3.5-flash-thinking",
    "gpt-5-thinking",
    "doubao-seed-1-6-thinking-250715",
    "gemini-2.5-flash-image",
    "qwen3.7-plus",
    "gpt-5.6-terra",
    "grok-4-1-fast-reasoning",
    "kimi-k2.5",
    "glm-5.3-flash",
    "claude-opus-4-7-thinking",
    "claude-sonnet-4-5-20250929",
    "gpt-5.4-mini",
    "gpt-5.6-luna",
    "kimi-k3.1-pro",
    "gemini-2.5-flash-preview-09-2025",
    "claude-fable-5-1",
    "gpt-5.4",
    "gpt-5-pro",
    "qwen3.5-plus",
    "gpt-5.6-luna-pro",
    "gpt-5",
    "MiniMax-M3",
    "claude-opus-4-8",
    "claude-sonnet-5",
    "grok-4-fast-reasoning"
   ]
  },
  {
   "id": "abacus",
   "name": "Abacus",
   "baseUrl": "https://routellm.abacus.ai/v1",
   "docsUrl": "https://abacus.ai/help/api",
   "visionModels": [
    "gemini-2.5-flash-image",
    "o3-pro",
    "gpt-5.6-terra",
    "o4-mini",
    "claude-sonnet-4-5-20250929",
    "gpt-5.4-mini",
    "gpt-5.6-luna",
    "gpt-5.4",
    "gpt-5",
    "claude-opus-4-8",
    "claude-sonnet-5",
    "claude-opus-4-6",
    "qwen3.8-max",
    "gpt-5.6-sol",
    "grok-4.3",
    "gemini-3-flash-preview",
    "gemini-3.5-flash-lite",
    "gemini-3.6-flash",
    "claude-sonnet-4-6",
    "claude-opus-4-7",
    "gpt-5.3-codex",
    "claude-opus-4-5-20251101",
    "gpt-4.1-mini",
    "gemini-3.7-flash",
    "gemini-3.1-pro-preview"
   ]
  },
  {
   "id": "abliteration-ai",
   "name": "abliteration.ai",
   "baseUrl": "https://api.abliteration.ai/v1",
   "docsUrl": "https://docs.abliteration.ai/models",
   "visionModels": [
    "abliterated-model"
   ]
  },
  {
   "id": "above",
   "name": "above.dev",
   "baseUrl": "https://api.above.dev/v1",
   "docsUrl": "https://above.dev/docs",
   "visionModels": [
    "mimo-v2.6-pro-ultraspeed",
    "glm-5.3-flash",
    "qwen3.8-max",
    "mimo-v2.6-flash",
    "mimo-v2.6-pro",
    "deepseek-v4.1-flash"
   ]
  },
  {
   "id": "agentrouter",
   "name": "AgentRouter",
   "baseUrl": "https://agentrouter.org/v1",
   "docsUrl": "https://agentrouter.org/docs/opencode.html",
   "visionModels": [
    "claude-opus-4-8",
    "gpt-5.6-sol",
    "claude-opus-5"
   ]
  },
  {
   "id": "agnes",
   "name": "Agnes AI",
   "baseUrl": "https://apihub.agnes-ai.com/v1",
   "docsUrl": "https://agnes-ai.com/doc",
   "visionModels": [
    "agnes-3.0-flash",
    "agnes-2.5-flash",
    "agnes-2.5-pro-alpha"
   ]
  },
  {
   "id": "ai-router",
   "name": "AI-ROUTER",
   "baseUrl": "https://api.ai-router.dev/v1",
   "docsUrl": "https://ai-router.dev/openai-compatible-api-gateway/",
   "visionModels": [
    "gpt-5.6-terra",
    "gpt-5.6-luna",
    "gpt-5.4",
    "gpt-5.6-sol",
    "gpt-5.5"
   ]
  },
  {
   "id": "aiand",
   "name": "ai&",
   "baseUrl": "https://api.aiand.com/v1",
   "docsUrl": "https://docs.aiand.com/",
   "visionModels": [
    "deepseek-ai/deepseek-v4.1-flash",
    "qwen/qwen3.6-27b",
    "qwen/qwen3.8-27b",
    "google/gemma-4-31b-it",
    "zai-org/glm-5.3-flash",
    "moonshotai/kimi-k3"
   ]
  },
  {
   "id": "aimlapi",
   "name": "AI/ML API",
   "baseUrl": "https://api.aimlapi.com/v1",
   "docsUrl": "https://docs.aimlapi.com",
   "visionModels": [
    "alibaba/qwen3.8-max-prime",
    "alibaba/qwen3.8-max",
    "alibaba/qwen3.8-27b",
    "alibaba/qwen3.8-flash",
    "moonshot/kimi-k3",
    "bytedance-seed/seed-1.6-flash",
    "bytedance-seed/seed-2.0-mini",
    "bytedance-seed/seed-2.0-lite",
    "bytedance-seed/seed-2.0-code",
    "perplexity/sonar-pro",
    "anthropic/claude-opus-4.8",
    "anthropic/claude-opus-4.5",
    "anthropic/claude-sonnet-5.5",
    "anthropic/claude-haiku-5.5",
    "anthropic/claude-fable-5.1",
    "anthropic/claude-haiku-4.5",
    "anthropic/claude-sonnet-5",
    "anthropic/claude-sonnet-4.5",
    "anthropic/claude-opus-5",
    "anthropic/claude-fable-5",
    "anthropic/claude-opus-5.5",
    "anthropic/claude-sonnet-4.6",
    "anthropic/claude-opus-4.7",
    "openai/o3-pro",
    "openai/gpt-5-5"
   ]
  },
  {
   "id": "ainetcafe",
   "name": "ainetcafe",
   "baseUrl": "https://microquickjs.com/v1",
   "docsUrl": "https://ainetcafe.com/k3/guides/",
   "visionModels": [
    "Kimi-K3"
   ]
  },
  {
   "id": "aixy",
   "name": "Aixy",
   "baseUrl": "https://api.aixy-gateway.com/v1",
   "docsUrl": "https://docs.aixy-gateway.com/integrations/overview",
   "visionModels": [
    "gemini/gemini-4-argon",
    "gemini/gemini-3.8-flash",
    "anthropic/claude-fable-5-1",
    "anthropic/claude-sonnet-5-5",
    "anthropic/claude-haiku-5-5",
    "anthropic/claude-opus-5-5",
    "openai/gpt-5.6-terra",
    "openai/gpt-5.6-luna",
    "openai/gpt-6-sol",
    "openai/gpt-5.6-sol",
    "openai/gpt-6.1-sol",
    "openai/gpt-6-luna",
    "openai/gpt-6-astra"
   ]
  },
  {
   "id": "alibaba",
   "name": "Alibaba",
   "baseUrl": "https://dashscope-intl.aliyuncs.com/compatible-mode/v1",
   "docsUrl": "https://www.alibabacloud.com/help/en/model-studio/models",
   "visionModels": [
    "qwen3.7-plus",
    "qwen3.5-plus",
    "qwen3.5-397b-a17b",
    "qwen3.8-max",
    "qwen3.6-27b",
    "qwen3.5-flash",
    "qwen3-vl-30b-a3b",
    "qwen3-vl-plus",
    "qwen3-asr-flash",
    "qwen-vl-ocr",
    "qwen3.8-omni-flash",
    "qwen3.5-35b-a3b",
    "qwen3.6-flash",
    "qwen3.7-flash",
    "qwen3-omni-flash",
    "qwen3.6-35b-a3b",
    "kimi-k3",
    "qwen3.5-27b",
    "qwen3.5-122b-a10b",
    "qwen3.8-flash",
    "qwen3.6-plus"
   ]
  },
  {
   "id": "alibaba-cn",
   "name": "Alibaba (China)",
   "baseUrl": "https://dashscope.aliyuncs.com/compatible-mode/v1",
   "docsUrl": "https://www.alibabacloud.com/help/en/model-studio/models",
   "visionModels": [
    "qwen3.7-plus",
    "kimi-k2.5",
    "qwen3.5-plus",
    "qwen3.5-397b-a17b",
    "qwen3.8-max",
    "qwen3.5-flash",
    "qwen3-vl-plus",
    "qwen3-asr-flash",
    "qwen-vl-ocr",
    "qwen3.8-omni-flash",
    "qwen3.6-flash",
    "qwen3.7-flash",
    "qwen3-omni-flash",
    "kimi-k3",
    "deepseek-v4.1-flash",
    "qwen3.8-flash",
    "qwen3.6-plus",
    "kimi-k2.6",
    "kimi/kimi-k2.5"
   ]
  },
  {
   "id": "alibaba-coding-plan",
   "name": "Alibaba Coding Plan",
   "baseUrl": "https://coding-intl.dashscope.aliyuncs.com/v1",
   "docsUrl": "https://www.alibabacloud.com/help/en/model-studio/coding-plan",
   "visionModels": [
    "qwen3.7-plus",
    "kimi-k2.5",
    "qwen3.5-plus",
    "qwen3.6-plus"
   ]
  },
  {
   "id": "alibaba-coding-plan-cn",
   "name": "Alibaba Coding Plan (China)",
   "baseUrl": "https://coding.dashscope.aliyuncs.com/v1",
   "docsUrl": "https://help.aliyun.com/zh/model-studio/coding-plan",
   "visionModels": [
    "qwen3.7-plus",
    "kimi-k2.5",
    "qwen3.5-plus",
    "qwen3.6-plus"
   ]
  },
  {
   "id": "alibaba-token-plan",
   "name": "Alibaba Token Plan",
   "baseUrl": "https://token-plan.ap-southeast-1.maas.aliyuncs.com/compatible-mode/v1",
   "docsUrl": "https://www.alibabacloud.com/help/en/model-studio/token-plan-overview",
   "visionModels": [
    "qwen3.7-plus",
    "kimi-k2.5",
    "deepseek-v4.1-flash-1017",
    "qwen3.8-max",
    "kimi-k2.7-code",
    "qwen3.6-flash",
    "happyhorse-1.1-i2v",
    "happyhorse-1.1-r2v",
    "deepseek-v4.1-flash",
    "qwen3.8-flash",
    "qwen3.6-plus",
    "kimi-k2.6"
   ]
  },
  {
   "id": "alibaba-token-plan-cn",
   "name": "Alibaba Token Plan (China)",
   "baseUrl": "https://token-plan.cn-beijing.maas.aliyuncs.com/compatible-mode/v1",
   "docsUrl": "https://www.alibabacloud.com/help/zh/model-studio/token-plan-overview",
   "visionModels": [
    "qwen3.7-plus",
    "kimi-k2.5",
    "deepseek-v4.1-flash-1017",
    "qwen3.8-max",
    "kimi-k2.7-code",
    "qwen3.6-flash",
    "happyhorse-1.1-i2v",
    "happyhorse-1.1-r2v",
    "deepseek-v4.1-flash",
    "qwen3.8-flash",
    "qwen3.6-plus",
    "kimi-k2.6"
   ]
  },
  {
   "id": "ambient",
   "name": "Ambient",
   "baseUrl": "https://api.ambient.xyz/v1",
   "docsUrl": "https://ambient.xyz",
   "visionModels": [
    "qwen/qwen3.8-27b"
   ]
  },
  {
   "id": "amd",
   "name": "AMD",
   "baseUrl": "https://developer.amd.com.cn/radeon/api/v1",
   "docsUrl": "https://developer.amd.com.cn/radeon/tokenfactory",
   "visionModels": [
    "Gemma-4-31B-IT",
    "Qwen3.8-27B",
    "MiniCPM-V-4.7-1B",
    "MiniCPM-V-4.7-35B-A3B",
    "DeepSeek-V4.1-Flash",
    "Qwen3.8-Flash-Next",
    "MiMo-V2.6-Flash"
   ]
  },
  {
   "id": "anyapi",
   "name": "AnyAPI",
   "baseUrl": "https://api.anyapi.ai/v1",
   "docsUrl": "https://docs.anyapi.ai",
   "visionModels": [
    "xai/grok-4.3",
    "perplexity/sonar-reasoning-pro",
    "perplexity/sonar-pro",
    "anthropic/claude-sonnet-4-5",
    "anthropic/claude-opus-4-6",
    "anthropic/claude-sonnet-4-6",
    "anthropic/claude-haiku-4-5",
    "anthropic/claude-opus-4-7",
    "openai/o4-mini",
    "openai/gpt-5.4",
    "openai/gpt-5",
    "openai/gpt-4.1-mini",
    "openai/o3",
    "openai/gpt-4.1",
    "openai/gpt-5-mini",
    "openai/gpt-5.1",
    "openai/gpt-5.2",
    "google/gemini-3-pro-preview",
    "google/gemini-3-flash-preview",
    "google/gemini-2.5-pro",
    "google/gemini-2.5-flash-lite",
    "google/gemini-2.5-flash",
    "mistralai/mistral-large-2512"
   ]
  },
  {
   "id": "arcee",
   "name": "Arcee",
   "baseUrl": "https://api.arcee.ai/api/v1",
   "docsUrl": "https://docs.arcee.ai",
   "visionModels": [
    "zai-org/glm-5.3-flash",
    "deepseek/deepseek-v4.1-flash-1017",
    "deepseek/deepseek-v4.1-flash"
   ]
  },
  {
   "id": "auriko",
   "name": "Auriko",
   "baseUrl": "https://api.auriko.ai/v1",
   "docsUrl": "https://docs.auriko.ai",
   "visionModels": [
    "kimi-k2.5",
    "claude-opus-4-6",
    "grok-4.3",
    "claude-sonnet-4-6",
    "claude-opus-4-7",
    "gemini-3.1-pro-preview",
    "qwen-3.6-plus",
    "gemini-2.5-pro",
    "gemini-2.5-flash",
    "kimi-k2.6"
   ]
  },
  {
   "id": "baseten",
   "name": "Baseten",